Question,Answer
Define a point, a line, and a plane. Explain with real-life examples.,A point shows an exact position and has no length or breadth (e.g., tip of a needle). A line is a straight path extending endlessly in both directions (e.g., edge of a ruler). A plane is a flat surface extending endlessly in all directions (e.g., surface of a table).
Explain the difference between a line segment, a ray, and a line.,A line segment has two fixed endpoints. A ray has one fixed endpoint and extends endlessly in one direction. A line has no endpoints and extends endlessly in both directions.
Draw and explain different types of angles.,Angles are formed by two rays with a common endpoint. Types include acute (<90°), right (=90°), obtuse (>90° and <180°), straight (=180°), reflex (>180° and <360°), and complete angle (=360°).
Explain what is meant by intersecting and parallel lines with examples.,Intersecting lines meet at a point (like crossing roads). Parallel lines never meet (like railway tracks).
Differentiate between open and closed figures with examples.,Open figures do not enclose any region (like a V shape). Closed figures enclose a region (like a triangle or square).
Explain the term polygon and classify polygons based on the number of sides.,A polygon is a closed figure made of line segments. 3 sides: triangle, 4 sides: quadrilateral, 5 sides: pentagon, 6 sides: hexagon, 7 sides: heptagon, 8 sides: octagon.
Describe the properties of a triangle.,A triangle has 3 sides, 3 angles, and 3 vertices. The sum of interior angles is 180°. It is the simplest polygon.
Explain different types of triangles based on sides.,Scalene: all sides different. Isosceles: two sides equal. Equilateral: all sides equal.
Explain different types of triangles based on angles.,Acute-angled: all angles <90°. Right-angled: one angle =90°. Obtuse-angled: one angle >90°.
Define quadrilateral and explain its types.,A quadrilateral has four sides. Types include square, rectangle, rhombus, parallelogram, trapezium, and kite.
Explain the properties of a square.,A square has four equal sides, four right angles, and opposite sides parallel.
Explain the properties of a rectangle.,A rectangle has opposite sides equal and parallel, and all angles are right angles.
Explain the properties of a parallelogram.,A parallelogram has opposite sides equal and parallel and opposite angles equal.
Explain the properties of a rhombus.,A rhombus has all sides equal and opposite angles equal.
Explain the properties of a trapezium.,A trapezium has one pair of parallel sides.
Explain the concept of a circle and its parts.,A circle is the set of all points equidistant from a fixed point (center). Parts include radius, diameter, chord, and circumference.
Differentiate between chord, diameter, and radius of a circle.,Radius is the distance from center to boundary, diameter is twice the radius passing through the center, and chord is any line joining two points on the circle.
Explain what is meant by interior and exterior of a closed figure.,The interior is the region inside the boundary of a closed figure, and the exterior is the region outside it.
Explain curved and straight lines with examples.,Straight lines have no bends (ruler edge). Curved lines bend (arc of a circle).
Explain the concept of angles formed by intersecting lines.,When two lines intersect, four angles are formed; vertically opposite angles are equal.
Define vertex, edge, and face of 3D shapes.,Vertex is a corner point, edge is the line segment joining two vertices, and face is a flat surface.
Explain cube and its properties.,A cube has 6 square faces, 12 edges, and 8 vertices.
Explain cuboid and its properties.,A cuboid has 6 rectangular faces, 12 edges, and 8 vertices.
Explain cylinder and its properties.,A cylinder has 2 circular faces, 1 curved surface, 2 edges, and no vertices.
Explain cone and its properties.,A cone has 1 circular face, 1 curved surface, 1 edge, and 1 vertex.
Explain sphere and its properties.,A sphere has one curved surface and no edges or vertices.
Differentiate between 2D and 3D shapes.,2D shapes have only length and breadth (square, triangle). 3D shapes have length, breadth, and height (cube, sphere).
Explain regular and irregular polygons.,Regular polygons have all sides and angles equal; irregular polygons do not.
Explain convex and concave polygons.,Convex polygons have all interior angles less than 180°, concave polygons have at least one interior angle more than 180°.
Explain what is meant by boundary of a figure.,The boundary is the outline or edge of a closed figure separating interior and exterior.
Explain the importance of geometrical shapes in daily life.,Shapes help in construction, design, architecture, road signs, and object identification.
Explain how angles are measured.,Angles are measured in degrees using a protractor.
Explain perpendicular lines with examples.,Perpendicular lines intersect at 90° (e.g., cross on a road).
Explain horizontal and vertical lines.,Horizontal lines are parallel to the ground; vertical lines are perpendicular to the ground.
Explain symmetry in simple shapes.,Symmetry means a shape can be divided into two identical halves.
Explain why a circle is not a polygon.,A polygon has straight sides, but a circle has a curved boundary.
Explain the difference between boundary and region.,Boundary is the outline of a shape; region is the area enclosed by it.
Explain what is meant by complete angle.,A complete angle measures 360° and represents one full turn.
Explain what is meant by straight angle.,A straight angle measures 180° and forms a straight line.
Explain the difference between acute and obtuse angles.,Acute angle is less than 90°, obtuse angle is greater than 90° but less than 180°.
Explain the concept of faces, edges, and vertices using a cube.,A cube has 6 faces, 12 edges, and 8 vertices which form its structure.
Explain why a sphere has no edges or vertices.,A sphere is perfectly round with no flat surfaces, so it has no edges or corners.
Explain the importance of classifying shapes.,Classification helps in understanding properties and comparing shapes easily.
Explain how shapes are used in architecture.,Architects use shapes for designing buildings, rooms, pillars, domes, and windows.
Explain how geometrical ideas help in map reading.,Maps use lines, angles, and shapes to represent roads, boundaries, and regions.
Explain the role of geometry in art and design.,Artists use shapes and symmetry to create patterns and designs.
Explain the difference between a simple closed curve and a complex closed curve.,A simple closed curve does not cross itself, while a complex closed curve crosses itself.
