Question,Answer
Define practical geometry.,Practical geometry is the branch of geometry where shapes are constructed using tools like compass, ruler, protractor, and set square.
Explain tools used in practical geometry.,Common tools: ruler (measure lengths), compass (draw circles), protractor (measure angles), set square (draw right angles/parallel lines), pencil, eraser.
Explain how to construct a line segment of given length.,Use a ruler to measure the required length and mark endpoints, join with a straight line.
Explain how to bisect a line segment.,Use compass: draw arcs from endpoints, join intersection points to form bisector.
Explain how to construct a perpendicular bisector of a line segment.,Use compass to draw arcs from endpoints, join intersections to form perpendicular bisector.
Explain how to draw a perpendicular to a line from a point on the line.,Use compass: arcs from point intersect line, draw perpendicular through point.
Explain how to draw a perpendicular to a line from a point outside the line.,Use compass: draw arcs from point intersecting line, draw arcs from intersection points, join point to intersection to form perpendicular.
Explain how to bisect an angle.,Use compass: draw arcs from vertex, arcs from intersections, join vertex to intersection of arcs.
Explain how to construct a triangle when all three sides are given (SSS).,Draw base, use compass to draw arcs from endpoints with other sides, mark intersection as third vertex, join vertices.
Explain how to construct a triangle when two sides and included angle are given (SAS).,Draw base, construct given angle, measure second side from angle, mark third vertex, join vertices.
Explain how to construct a triangle when two angles and included side are given (ASA).,Draw side, construct first angle at one end, construct second angle at other end, join intersection as third vertex.
Explain how to draw a triangle when base and two other sides are given (SSA).,Draw base, draw arcs from endpoints with given sides as radius, intersection gives third vertex.
Explain how to draw a circle of given radius.,Use compass, set radius, place needle at center, draw circle.
Explain how to draw a tangent to a circle from a point on the circle.,Tangent is perpendicular to radius at that point.
Explain how to draw a tangent to a circle from a point outside the circle.,Draw line from point to center, bisect line, draw perpendicular from midpoint to line joining point to center.
Explain how to construct an equilateral triangle.,Draw a line as base, arcs from endpoints equal to base, intersection is third vertex, join vertices.
Explain how to construct a square using compass and ruler.,Draw one side, construct perpendicular at endpoints, mark other sides equal, join vertices.
Explain how to construct a rectangle using compass and ruler.,Draw one side, construct perpendiculars at endpoints, mark opposite sides equal, join vertices.
Explain how to construct a rhombus using diagonals.,Draw diagonals perpendicular, mark endpoints, join vertices to form rhombus.
Explain how to construct a parallelogram given base, side, and angle.,Draw base, construct given angle at one endpoint, mark side along line, draw parallel from other endpoint, join vertices.
Explain how to construct a kite given diagonals.,Draw diagonals perpendicular, use as reference to draw sides connecting endpoints, join vertices.
Explain how to construct a trapezium given parallel sides and non-parallel sides.,Draw one base, construct angles or use compass to mark lengths, join vertices.
Explain how to measure an angle using a protractor.,Align protractor with vertex, read value where second line intersects scale.
Explain how to draw an angle of given measure using protractor.,Mark vertex, align protractor, mark degree on scale, draw line through mark.
Explain how to construct a triangle similar to a given triangle using scale factor.,Measure sides, multiply by scale factor, draw new triangle using SSS or SAS method.
Explain how to construct a line parallel to a given line through a point.,Use compass: draw transversal, replicate angle, draw line through point.
Explain step by step method to draw a circle passing through three non-collinear points.,Draw arcs from points intersecting at circle center, adjust compass radius, draw circle through points.
Explain construction of a circle touching two given lines.,Find angle bisector of lines, draw circle center at bisector, radius to point of contact.
Explain how to construct an incircle of a triangle.,Draw angle bisectors of triangle, intersection is center, distance to side is radius, draw circle.
Explain how to construct circumcircle of a triangle.,Draw perpendicular bisectors of sides, intersection is center, distance to vertex is radius, draw circle.
Explain construction of tangent to a circle using perpendicular radius.,Draw radius to point of contact, draw perpendicular to radius at that point as tangent.
Explain construction of tangent to two circles externally.,Join centers, mark points of contact using radii, draw tangents touching both circles externally.
Explain construction of tangent to two circles internally.,Join centers, draw points of contact along line joining centers, draw tangent touching both circles internally.
Explain how to draw a hexagon using compass.,Draw circle, set radius = side length, mark points on circumference using compass, join consecutive points.
Explain how to draw an octagon using compass.,Draw circle, divide circumference into 8 equal parts using protractor or compass, join points consecutively.
Explain how to draw a triangle when perimeter and two angles are given.,Calculate third angle, use SSS or ASA method to construct triangle accordingly.
Explain how to draw a triangle when sides and one angle not included are given.,Use compass for sides, angle at one endpoint, construct remaining sides to complete triangle.
Explain construction of a quadrilateral given four sides and one diagonal.,Draw diagonal, mark sides using compass from endpoints, join remaining vertices.
Explain construction of a quadrilateral given two diagonals and three sides.,Draw one diagonal, mark sides from endpoints, draw other diagonal using compass, join vertices.
Explain how to use geometric instruments correctly.,Use ruler for straight lines, compass for arcs/circles, protractor for angles, keep pencil sharp, measure carefully.
Explain step by step method to check accuracy of constructions.,Verify lengths using ruler, angles using protractor, symmetry and perpendicularity, ensure correctness.
Explain how to draw a figure from given dimensions of a polygon.,Mark base, construct sides and angles using ruler/protractor/compass according to given dimensions.
Explain how to construct tangents to a circle from external points.,Draw line from point to center, construct perpendicular bisector, draw tangents from external point.
Explain how to construct bisector of an angle using compass.,Draw arc from vertex intersecting both arms, draw arcs from intersections, join vertex to intersection of arcs.
Explain how to construct triangle using coordinate method.,Plot points using coordinates, join points to form triangle.
Explain how to construct a triangle using perpendiculars.,Draw base, draw perpendicular from vertex to base for height, complete triangle using measurements.
Explain how to construct congruent triangles.,Copy side and angles using compass and protractor to construct identical triangle.
Explain how to solve practical geometry problems step by step.,Read problem carefully, identify type of figure, choose correct method, use instruments, construct accurately, verify measurements.
