Question,Answer
"Analyze the banyan tree as a 'microcosm' of nature.","It houses various species (squirrels, birds, snakes) in a delicate balance"
"How does the narrator’s 'neutral' observation enhance the fight's intensity?","By not interfering, he allows the reader to see the raw, unedited laws of nature"
"What is the symbolic significance of the 'Cobra vs. Mongoose' conflict?","It represents the age-old battle between predator and specialized hunter"
"Explain the 'Irony of the Spectators'.","The birds came to watch but became victims and victors themselves"
"How does Ruskin Bond use 'Sensory Details' to build tension?","Through the 'hissing', 'flickering tongue', and the 'hot afternoon' silence"
"Analyze the mongoose’s 'reflexes' as an evolutionary advantage.","His ability to dodge a 'lightning' strike is a specialized survival trait"
"What does the 'Banyan Tree' represent for the narrator's childhood?","Freedom, imagination, and a bridge between the human world and the wild"
"Explain the 'Moral of the Story' regarding the ecosystem.","Nature has its own system of checks and balances (mongoose vs. snake)"
"How does the 'Magpie's Death' serve as a 'Reality Check'?","It proves that nature is dangerous even for those who are just 'watching'"
"Analyze the 'Hypnotic' nature of the cobra’s eyes.","It is a tool used to paralyze prey, which failed against the intelligent mongoose"
"What does 'delving into pockets' symbolize for the human-animal bond?","The possibility of trust between different species when there is no fear"
"Explain the 'Bushy Tail' and 'Spread Hood' as 'Visual Rhetoric'.","Both animals are communicating their strength and intent before the first move"
"How does the setting of the 'Garden' contrast with the 'Forest' (from Ch 2)?","The garden is 'tame', but the banyan tree remains a pocket of 'wild' reality"
"Analyze the narrator’s 'Platform' as a 'Metaphor' for his perspective.","He is elevated above the ground, allowing him to see the 'big picture'"
"What does the 'Snake' represent in the cultural context of the garden?","A hidden danger that requires a 'protector' like the mongoose"
"Explain the 'Victory Cry' of the myna.","It is an acknowledgment of the 'Fair Play' (Ch 7) of nature's law"
"How does the story explore the theme of 'Solitude'?","The boy finds his greatest excitement when he is alone in the tree"
"Analyze the 'Speed' of the mongoose vs. the 'Power' of the cobra.","Speed and strategy ultimately triumphed over raw venom and size"
"What is the significance of the 'Red Figs'?","They are the 'bait' that brings life and activity to the tree"
"How does the 'Grandfather's Wisdom' influence the boy's view?","By teaching him to value the mongoose, he shaped the boy's respect for nature"
"Analyze the 'Cactus' as a 'Safe Zone' that failed.","It provided a perch, but not protection from the snake's reach"
"What does 'Glittering' and 'Glassy' eyes tell us about 'Predatory focus'?","It is an intense, unblinking concentration on the target"
"Explain the 'Rhythm' of the fight.","It moves from 'Stillness' to 'Sudden Strike' and back to 'Tired Movement'"
"How does Bond 'Personify' the myna?","By giving it the human quality of 'congratulating' the winner"
"What does the 'Platform' represent in terms of 'Intellectual Growth'?","The combination of reading books and observing nature"
"Analyze the 'Snout Grip' as the 'Climax' of the physical battle.","It was the point of no return for the cobra"
"How does the 'Banyan Tree' act as a 'Guardian' of the narrator?","It hides him and keeps him safe while he watches dangerous events"
"Explain the 'Tragedy of the Magpie'.","A bystander who died because of over-enthusiasm and lack of caution"
"What is the 'Ethical' takeaway of the story?","To respect the wild and understand that everything has a role to play"
"Analyze the 'Grayish' fur of the mongoose as 'Camouflage'.","It helped him blend into the shadows of the tree and the clearing"
"How does the story bridge the 'Chapters' of the book (Identity, Fair Play)?","The boy finds 'Who He Is' (Observer) through 'Fair Play' (Nature's Justice)"
"What does 'Treasure Island' suggest about the narrator's 'Internal World'?","He sees his own garden as a place of adventure and hidden secrets"
"Analyze the 'Hissing' and 'Shrieking' as 'Nature's Dialogue'.","A communication of threat, warning, and eventual victory"
"How does the 'Hot Afternoon' act as a 'Contrast' to the 'Violent Fight'?","The peaceful weather makes the sudden brutality more shocking"
"Explain the 'Prop-roots' as a 'Maze' for the animals.","They provide cover and escape routes for the squirrel and mongoose"
"What is the 'Legacy' of the banyan tree for the narrator?","A lifetime of memories of the day he saw the 'greatest' fight"
"Analyze the 'Grandmother's' dislike of the tree.","It represents a more 'civilized' or 'practical' view of nature"
"How does the 'Mongoose' represent 'Efficiency'?","He doesn't waste energy and waits for the perfect moment to kill"
"What does 'Glistening Scales' tell us about 'Beauty' (Poem 4)?","That even deadly things have an aesthetic beauty in nature"
"Explain the 'Flash of Lightning' simile for the cobra's strike.","It emphasizes the extreme speed that humans usually can't track"
"How does the 'Myna's survival' show the 'Value of Caution'?","By learning from the magpie's mistake, it lived to fly away"
"Analyze the 'Platform' as a 'Boundary' between Man and Beast.","It allows the boy to be near the wild without being part of it"
"What is the 'Role' of the 'Banyan Tree' in the local ecology?","It is a 'Keystone species' that supports a massive amount of life"
"Explain the 'Responsibility' of the narrator in 'Not Interfering'.","His role as a storyteller depends on him being an unbiased witness"
"How does the 'Mongoose' act as a 'Gardener' (Poem 7)?","He 'cleans' the garden of snakes just as a gardener cleans weeds"
"What does 'Flickering Tongue' represent in 'Snake Communication'?","A sensory 'exploration' of the threat level"
"Analyze the 'Bushy Tail' as a 'Shield'.","It protects the mongoose's body from being easily targeted by fangs"
"How does the 'Final Drag' into the bushes represent 'Nature's Cleanup'?","The cycle is complete; the prey is taken away, and the clearing is quiet again"
"What is the 'Emotional Arc' of the narrator during the fight?","From 'Curiosity' to 'Tension' to 'Awe'"
"What is the final 'Lesson' of the Banyan Tree?","That the world is full of wonder if you are willing to sit still and watch"