Question,Answer
"What does 'ill-pleased' mean in the context of the dog?","Not happy or satisfied with his current life"
"Why did the dog think the Wolf was a good master?","Because the Wolf was big, strong, and fierce"
"Explain the relationship between the Wolf and the Dog.","They were relatives (cousins), but the Dog wanted a master-servant bond"
"Why did the Bear decide to hunt a cow?","To provide food for both himself and the dog"
"What does 'panicked' mean for the cows?","They were terrified and running uncontrollably"
"Why was the dog surprised that the Bear was afraid?","Because he thought the Bear was the strongest animal"
"What does the Lion's 'great roar' tell us about him?","That he is a powerful and commanding figure"
"Why did the dog stay with the Lion for 'a long, long time'?","Because no one dared to touch or offend the dog"
"What did the Lion do to show his fear of Man?","He began to back away quietly"
"How did the dog perceive 'Strength' throughout the story?","He equated strength with the ability to protect him"
"Why is Man considered the ultimate master?","Because even the strongest animal, the Lion, is afraid of him"
"What does 'loyal servant' imply about the dog?","The dog serves with total devotion and never leaves"
"What was the 'terrible noise' the cows heard?","Likely the Lion's roar or a sign of a predator"
"How did the dog's search change him?","He went from being a scared wanderer to a protected companion"
"What does 'frightened' imply about the Wolf?","That even strong predators have something to fear"
"Why did the dog decide to leave each master?","Because he discovered someone stronger who intimidated them"
"What is the significance of the dog's smell?","The Lion used his sense of smell to detect the approach of a man"
"Define 'kinship' in the story.","The biological relationship between the dog and the wolf"
"How did the dog approach the Lion?","With respect and a request for service"
"Why did the Bear run 'hastily' into the forest?","To hide because he realized the Lion was nearby"
"What does 'to take up service with' mean?","To become someone's employee or servant"
"Why did the dog want to 'serve' rather than lead?","Because he wasn't strong enough to protect himself"
"Describe the dog's life with the Man.","He stayed with him, served him faithfully, and never left"
"What does 'offend' mean in the story?","To make someone angry or upset"
"Why was the Lion struck with terror?","Because he knew Man could hunt or harm him"
"How does the story explain the dog's domestication?","As a choice made by the dog for safety and survival"
"What was the Wolf's 'fierceness' compared to?","The Bear's 'strength'"
"Why did the cows stop in a panic?","They sensed the danger of the Lion"
"What does 'wandering about by himself' imply?","Isolation and lack of security"
"Why did the dog want a master 'stronger than anyone else'?","To ensure he was at the top of the safety chain"
"Explain the phrase 'I am off'.","The dog's way of saying he is leaving to find someone better"
"What did the dog find 'best' in the end?","Living with Man"
"Why did the Lion 'roar' before walking away?","It was a sign of his power, but also a final warning"
"What does 'hastily' tell us about the Bear?","He was in a great hurry to hide"
"How did the dog feel about the Bear's fear?","He was disappointed and moved on"
"What was the dog 'looking for'?","Protection and a reliable source of food"
"Why did the dog choose a master over freedom?","Freedom was too dangerous and difficult for him"
"What does 'faithfully' mean?","With honesty and consistency"
"How did the Lion notice the Man?","By catching his scent in the air"
"Why was the dog 'sick' of his life?","Because of the constant fear and physical exhaustion"
"What does 'take my leave' mean?","To say goodbye and depart"
"Why did the dog call the Man 'Master'?","To show he accepted Man as the highest power"
"What does 'dare' mean in the forest context?","To have the courage to challenge or attack"
"Why did the dog choose the Lion after the Bear?","Because the Lion was the ruler of the forest"
"Explain the 'terrible noise' again.","It was the roar that caused the cows to flee"
"What was the Bear's plan for the cows?","To eat their fill"
"How did the dog show he was a 'good servant'?","By staying with the Lion for a very long time"
"Why did the dog not stay with the Wolf?","Because the Wolf lacked the strength to face the Bear"
"What does 'wild' mean at the start of the story?","Living in nature without human control"
"Why is the ending of the story satisfying?","Because the dog finally finds the peace and safety he sought"