Question,Answer
"Analyze the theme of 'Filial Piety' in Taro’s Reward.","It shows that total devotion to parents is the highest virtue"
"What does the waterfall symbolize in terms of karma?","A mirror that reflects the goodness or greed of the soul"
"How does the setting of a 'lonely hillside' contribute to the story?","It highlights Taro's isolation and the purity of his struggle"
"Explain the 'test' that the villagers failed.","The test of patience and selfless intent vs. greed"
"Why is the story considered a 'didactic' tale?","Because its primary purpose is to teach children moral values"
"Analyze the symbolism of 'Sake' vs. 'Water'.","Sake represents divine grace; Water represents ordinary reality"
"How does Taro’s 'A' grade (metaphorical) compare to Patrick's?","Taro’s reward is for character; Patrick’s is for effort"
"What is the significance of the Emperor naming a fountain after Taro?","It elevates a commoner's virtue to a national symbol"
"How does the author use 'sensory imagery' to describe the cold?","Through the 'whistling' sound and the father 'shivering'"
"What does the villagers' 'procession' represent socially?","The tendency of a crowd to follow a rumor for personal gain"
"Why was the waterfall 'magic' only for one person?","To show that spiritual rewards are not for mass consumption"
"Explain the moral: 'To the thoughtful son, the waterfall gave sake'.","Virtue creates its own abundance"
"How does the story view 'poverty'?","As a condition that tests but does not define one's character"
"Analyze the father’s 'dance' as a cultural expression.","It shows joy that transcends physical age and hardship"
"Why was the gold 'twenty pieces'?","A perfect number representing completeness and fortune"
"What does 'hiding behind a rock' symbolize in a hero’s journey?","The wisdom to wait while the 'storm' of the crowd passes"
"How does the story bridge the gap between 'Nature' and 'Man'?","Through a magical link where nature rewards human goodness"
"Why is the Emperor's decree at the end important?","It turns a local legend into a universal moral law"
"Analyze the 'greedy' drinking of the neighbor.","It foreshadows the failure of the villagers later on"
"What does 'rushing water' symbolize in Taro's life?","The arrival of help when all human options were exhausted"
"How does 'Taro’s Reward' reflect Japanese cultural values?","Through the emphasis on respect, honor, and nature"
"What is the irony in the villagers wanting to 'drown' Taro?","They wanted to kill the one person who actually brought them the 'blessing'"
"How does the 'magic' element resolve the conflict of poverty?","It provides a supernatural solution to an insurmountable problem"
"What does the 'fountain' represent at the end?","The fluidity and persistence of a good reputation"
"Why did Taro work 'longer' but earn 'less'?","To emphasize the unfairness of his struggle before the reward"
"Analyze the 'test' of the taste.","Taro tasted it multiple times to ensure it wasn't a delusion"
"How does the story treat 'Greed'?","As a blinding force that turns wine into water"
"What does 'whistling wind' suggest about Taro’s home security?","Their physical house was as vulnerable as their finances"
"Why was Taro's reward both 'material' (gold) and 'symbolic' (fountain)?","To reward both his family's needs and his personal name"
"Explain the importance of the 'pitcher' in the story.","It is the vessel through which the miracle is shared"
"How does the author characterize the villagers?","As a collective, impulsive, and easily angered group"
"What does 'delicious' sake say about the 'quality' of Taro's reward?","Heaven gives only the best to those who are good"
"Why did Taro's father wish for sake in his 'old age'?","To reclaim a moment of warmth in a harsh life"
"Analyze the 'morning' as a time for 'new beginnings'.","Taro’s discovery happens at dawn, signifying a new phase"
"What is the significance of Taro being a 'woodcutter'?","He works with the 'roots' of the forest, showing his grounded nature"
"How does the 'lonely hillside' emphasize his devotion?","There was no one watching him; he was good even in secret"
"Why did the neighbor leave 'in a hurry'?","To be the first to spread the news (vanity/gossip)"
"What does the 'red eye' lamp (from a different poem) and this waterfall share?","Both are 'observers' of human behavior"
"How does the story define a 'Model Son'?","One who provides for the spirit as much as the body"
"Analyze the 'nothing but water' cry.","It is the sound of reality crashing against greed"
"Why was the Emperor 'moved' by the story?","Because true virtue is rare and inspiring even to kings"
"How does the 'magic' enhance the 'lesson'?","It makes the moral undeniable and memorable"
"What does 'twenty pieces of gold' say about Taro's future?","He would never have to chop wood in despair again"
"Why did the Emperor name the 'most beautiful' fountain after him?","Beauty of the fountain reflects the beauty of Taro’s heart"
"Analyze the 'purity' of Taro's hands.","He used his bare hands to taste, showing his connection to nature"
"How does the story conclude the 'Justice' theme?","The good are elevated; the greedy are left with nothing"
"Why is 'Thoughtfulness' the keyword of the chapter?","It is the internal engine that drove Taro’s outward actions"
"What does 'whistling through the cracks' say about his resilience?","He ignored his own cold to worry about his father's"
"Analyze the 'transition' from forest to palace.","Taro’s world expanded from a hut to the Emperor's notice"
"What is the final 'reward' for the reader?","The satisfaction of seeing a good man win"