Question,Answer
"What does 'thoughtful' imply about Taro’s character?","He put his parents' needs before his own comfort"
"Why did Taro work 'harder than ever' after his father's wish?","To earn extra money to buy the expensive sake"
"Explain the significance of the 'whistling wind'.","It emphasizes the poverty and lack of warmth in Taro's home"
"Why was Taro 'surprised' to hear rushing water?","He knew the forest well and knew no stream was nearby"
"What does 'delicious' sake represent for the father?","Health, warmth, and a rare luxury"
"Why did the neighbor drink the sake 'greedily'?","She didn't appreciate the sacrifice behind it, only the luxury"
"How did the magic waterfall act as a judge?","It provided based on the intentions and heart of the person"
"What does 'muttered' mean in the context of the villagers?","Speaking in a low, angry, and complaining tone"
"Why did the villagers think Taro had 'tricked' them?","Because they only found water where he found sake"
"What does 'intended to drown him' show about the villagers?","Their extreme anger and lack of patience or faith"
"Why did the Emperor reward Taro with gold?","To encourage all children to honor and obey their parents"
"Explain the phrase 'stopped shivering'.","The sake provided instant physical and emotional relief"
"What is the meaning of 'pittance' (implied by 'very little')?","A very small amount of money"
"How did Taro's behavior during the villagers' visit show his wisdom?","He remained hidden to avoid unnecessary conflict"
"Why did the waterfall change back to sake for Taro?","To prove its magic was reserved for the virtuous"
"What does the fountain's name symbolize?","Taro’s eternal legacy of kindness"
"Why was Taro's house described as 'sad'?","Because they were poor and couldn't afford basic comforts"
"What does 'chopping and cutting' represent?","Taro's tireless and repetitive hard work"
"How did the news reach the Emperor?","Through the travelers and the spreading story"
"Why was the gold 'twenty pieces'?","A significant amount to change Taro's family's life"
"What does 'kneeling' by the waterfall suggest?","Taro's respect and humility toward nature"
"Why did the villagers bring 'the largest' pitchers?","Their greed made them want to take as much as possible"
"Describe the irony of the villagers' morning trip.","They went for a reward but left with a 'punishment' of plain water"
"What does 'cupped a little in his hands' tell us?","Taro was careful and didn't waste the magic liquid"
"How did the father's 'dance' change the mood?","It turned a cold, sad evening into a celebration"
"Why was Taro 'sadder than ever'?","His inability to provide for his father's simple wish pained him"
"What does 'rushing' water symbolize?","A sudden flow of hope or life"
"How did the neighbor contribute to the plot?","By spreading the secret, she set the stage for the villagers' trial"
"Why did Taro hide 'behind a rock'?","For self-preservation against the 'mutters' of the crowd"
"What does 'cold water' represent for the villagers?","The reality of their own lack of virtue"
"Why did the Emperor choose Taro for such high honor?","Because Taro was the best example of 'filial piety'"
"What does 'woodcutter' tell us about Taro's social status?","He was a humble, lower-class laborer"
"How did the waterfall 'know' Taro was coming?","Folklore often treats nature as a sentient observer"
"Why did Taro's father wish for sake specifically?","It was believed to give strength and warmth to the elderly"
"What does 'earlier than ever' show about Taro's drive?","His love for his father was his greatest motivation"
"Why was the waterfall 'beautiful'?","Its beauty matched the beauty of Taro's heart"
"What does 'nothing but water' emphasize?","The villagers' absolute disappointment"
"How did Taro feel when he tasted sake again?","Validated and grateful"
"Why was the fountain named 'Taro'?","To serve as a permanent reminder of his goodness"
"What does 'whistling through the cracks' describe?","The poor condition of their small hut"
"How did the Sake change the father's health?","It gave him energy and a sense of well-being"
"Why did the villagers go 'by nightfall' to Taro's house?","Curiosity and a desire for the magic drink"
"What does 'disappointed' mean for the villagers?","Feeling let down because their expectations weren't met"
"Why was the Emperor's reward 'gold' and not 'sake'?","Gold is a permanent improvement to their livelihood"
"What does 'honor' mean in this story?","Being recognized by a king for one's character"
"How did Taro find the waterfall?","Through his ears (sound) and his thirst"
"Why did Taro not get angry with the villagers?","He was too humble and thoughtful for anger"
"What does 'magic' signify in this folktale?","Justice and divine intervention"
"How did the story end for Taro's parents?","They lived comfortably and happily"
"What is the purpose of the 'Emperor' character?","To show that true goodness is recognized by the highest authority"