Question,Answer
"What is the 'Different' in 'A Different Kind of School'?","The focus on emotional intelligence and empathy over academic grades"
"How does Miss Beam's school solve the problem of 'apathy' in society?","By forcing students to experience 'misfortune' firsthand"
"Analyze the narrator’s 'ghastly' feeling as a psychological response.","It shows a natural human discomfort with perceived suffering"
"What is the 'social contract' between the blind child and the helper?","A bond of total trust and absolute responsibility"
"Explain the 'educational philosophy' of Miss Beam.","To make children 'responsible' and 'thoughtful' citizens through experience"
"Why is 'Blind Day' a better teacher than a book on blindness?","Because it provides an 'embodied' experience of the struggle"
"How does the school prepare students for the 'real world'?","By teaching them to appreciate their health and sympathize with others"
"What does 'willpower' on Dumb Day symbolize in a person's life?","The ability to control one's impulses and speech"
"Analyze the role of the narrator as a 'witness'.","He represents the 'outside world' coming to learn from the school"
"How does the 'bandage overnight' heighten the 'reality' of the game?","It removes the 'choice' to see, making the blindness feel permanent"
"What is the 'paradox' of Miss Beam’s school?","Children 'play' at being 'suffering' to learn 'kindness'"
"How does the 'Blind' girl's headache represent 'mental fatigue'?","It shows that disability requires intense mental concentration"
"Explain the significance of 'Millie' as a Head Girl in this context.","She leads by example, even in the most difficult tasks"
"What does 'Ten times more thoughtful' imply about regular education?","It suggests that normal schools often ignore character building"
"Analyze Miss Beam's physical description as a 'symbol' of the school.","She is 'authority' (rules) mixed with 'kindly' (heart)"
"What is the 'moral' value of the 'helpers' learning from the 'disabled'?","Empathy is a two-way street that enriches both the giver and the receiver"
"How does the story use 'sensory descriptions' to aid the 'blind' girl?","It uses words to bridge the gap between darkness and light"
"What does 'Peter' the gardener represent in the school's ecosystem?","The 'steady' and 'natural' growth of the students' minds"
"Explain the 'psychological transformation' of the narrator.","He moved from pity ('ghastly') to profound respect ('ten times thoughtful')"
"Why is the 'Head Girl' wearing 'pink' and 'blue' significant?","It adds 'color' to the 'darkness' of the blind girl's world"
"How does 'willpower' connect to 'citizenship'?","A good citizen must be able to control themselves for the greater good"
"Analyze the 'difficulty' of the 'Blind Day' vs. the 'Lame Day'.","Sensory deprivation is more isolating than physical limitation"
"What does the narrator's 'reluctance' to leave suggest?","He found a moral 'home' in the school's atmosphere"
"How does Miss Beam’s school address 'inclusion'?","By making the 'abled' understand the 'disabled'"
"What is the 'hidden curriculum' of Miss Beam’s school?","The development of the 'soul' alongside the 'mind'"
"Explain the phrase 'misfortune is not so bad'.","It implies that with help and understanding, challenges can be managed"
"How does the 'Blind' girl's fear of 'hitting things' mirror real-world anxiety?","It represents the vulnerability of those without 'sight' or 'knowledge'"
"Analyze the 'garden' as a metaphor for the students.","A place where variety is nurtured and everyone has a role"
"What does 'Grey hair' on Miss Beam symbolize?","Her experience and the maturity of her educational vision"
"How does the narrator's 'description' of the garden become 'art'?","He paints a picture with words for someone who cannot see"
"Why is 'Dumb Day' considered a test of 'soul'?","Because silence is the hardest discipline for a human"
"Explain the 'responsibility' felt by the four-year-old helper.","Even the youngest are taught that their 'care' matters"
"How does 'A Different Kind of School' critique modern education?","It argues that 'results' should be measured in 'kindness,' not 'marks'"
"Analyze the 'bandage' as a 'mask' of truth.","It hides the physical world to reveal the emotional one"
"What is the 'relief' of the narrator in describing the head girl?","He felt he was successfully 'connecting' the girl to her world"
"How does 'sympathy' translate into 'action' in this school?","Through the 'assignment' of helpers"
"What does 'Authority' mean when it is 'full of kindness'?","It is leadership that inspires rather than commands"
"Explain the 'mental picture' built by the 'blind' girl.","A reconstruction of reality based on trust and description"
"How does the story promote 'Universal Brotherhood'?","By teaching that everyone’s pain is our own"
"Analyze the 'Headache' as a physical symptom of 'empathy'.","The girl 'felt' the world so intensely it hurt"
"What does 'Peter' being 'hundreds of years old' tell us about 'time'?","That 'kindness' is an ancient and timeless value"
"How does the 'Lame girl' watching the play highlight 'isolation'?","It shows the emotional gap between the 'abled' and the 'disabled'"
"Why did the narrator's 'spirit' feel 'ghastly' initially?","He was projecting his own fears of disability onto the children"
"What is the 'Ultimate Lesson' of the chapter?","To see the 'heart' of a person rather than their 'handicap'"
"How does 'Millie' represent the 'ideal' student?","She participates fully in the 'suffering' to become a better leader"
"Explain the 'willpower' required for silence in a social setting.","It is the 'silent' strength of character"
"How does the 'Different Kind of School' influence the reader?","It forces the reader to evaluate their own 'thoughtfulness'"
"What is the 'legacy' Miss Beam wants to leave?","A generation of 'thoughtful' and 'kind' human beings"
"Analyze the 'walk' in the garden as a 'journey of discovery'.","Each step taught the narrator more than any classroom lecture"
"What is the 'moral architecture' of Miss Beam’s school?","It is built on the pillars of sympathy, responsibility, and truth"