Question,Answer
"Analyze the house as a 'body' and the home as a 'soul'.","The house is the physical frame; the home is the life within it"
"How does the poet use 'Concreteness' vs 'Abstraction'?","House uses concrete nouns (brick); Home uses abstract nouns (love)"
"Explain the 'Social' importance of the distinction between house and home.","It reminds us that material wealth doesn't equal happiness"
"How does the poem redefine 'Architecture'?","Architecture is not just building walls, but building relationships"
"Analyze the word 'Unselfish'.","It is the 'glue' that holds the emotional structure of a home together"
"What is the 'Irony' of a house with many doors but no love?","It has many ways in and out, but no reason to stay"
"How does 'Lorraine M. Halli' use 'Contrast' to deliver her message?","By placing cold materials and warm emotions in back-to-back stanzas"
"What does 'Stucco and Roof' represent in a psychological sense?","The 'mask' or 'shelter' we show to the outside world"
"Explain 'Showing you're always caring' as a 'Daily Practice'.","It suggests that a home is a constant, active creation"
"How does the poem 'Humanize' a living space?","By shifting the focus from 'what it is' to 'who is in it'"
"Analyze the 'Physicality' of the house stanza.","It creates a sense of heaviness and permanence (stone, brick)"
"Analyze the 'Fluidity' of the home stanza.","It creates a sense of movement and interaction (sharing, doing)"
"What is the 'Ethics' of the poem?","The moral duty to be unselfish and kind within the family"
"How does the poet use 'Alliteration' or 'Rhythm'?","The repetition of 'What is a...' sets a predictable, didactic beat"
"What does 'Hard wood' symbolize?","The lack of emotional flexibility in a mere structure"
"How does 'Glass' represent 'Transparency' or 'Fragility'?","A house is visible but can be cold and easily broken without care"
"Explain 'Doing for others' as a 'Sacrifice'.","It is the willingness to give up personal gain for the family's good"
"What is the 'Legacy' of a home?","The memories and bonds shared by the family"
"How does the 'Yard' symbolize 'Boundary'?","It marks the limit of the house's physical reach"
"How does 'Love' act as the 'Cement' of a home?","It binds the 'living' bricks (people) together"
"Analyze the role of 'Siblings' in the poem.","They represent the first social circle where sharing is learned"
"Analyze the role of 'Parents' as the 'Foundation' of a home.","They provide the structure of care that supports the children"
"What is the 'Philosophy' behind 'A House, A Home'?","Materialism vs. Humanism"
"How does 'Sharing' prevent a house from being 'Empty'?","It fills the space with human connection"
"Explain the 'Visual' vs 'Invisible' elements of the poem.","The house is seen; the home is felt"
"Why is the 'House' stanza first?","To establish the physical reality before introducing the emotional one"
"What does the 'Chimney' represent metaphorically?","The release of 'smoke' or 'tension' in a healthy household"
"What is the 'Universal' truth in this poem?","That people make a place, not things"
"How does 'Lorraine Halli' use 'Simple Diction' to reach a child?","By using common words to explain a deep emotional truth"
"Analyze the 'permanence' of a house vs a home.","A house can crumble; a home lives on in the heart"
"What does 'Lots of doors' imply about 'Opportunities' in a home?","In a home, doors are for welcoming, not just for closing"
"Explain 'Always' in 'Always caring'.","It highlights the 'timeless' nature of family love"
"How does 'Tile' compare to 'Heart'?","Tile is hard and cold; the heart is soft and warm"
"What is the 'Conflict' resolved in the poem?","The confusion between a building and a sanctuary"
"How does the poem act as a 'Guide' for living?","By teaching the values of unselfishness and kindness"
"Analyze 'Brick and Stone' as 'Obstacles' to a home.","They can be cold barriers if love is missing"
"What is the 'Warmth' mentioned (implicitly)?","The emotional heat generated by family affection"
"How does the poem define 'Family'?","As a group of people who act unselfishly for each other"
"What does 'Stucco' represent in terms of 'Beauty'?","External beauty that means nothing without internal love"
"Analyze the 'Structure' of the stanzas.","They are mirrored to show the two sides of a 'Place'"
"What is the 'Moral Architecture' of the poem?","Love, Kindness, and Sharing are the pillars"
"How does 'Lorraine Halli' value 'Service'?","Through the phrase 'Doing for others'"
"What is the 'Light' in the house (metaphorically)?","The family presence"
"How does 'sharing' lead to 'abundance'?","A home feels 'full' even if the house is small"
"What does 'Hard wood' and 'Hard' hearts have in common?","Both make a space feel like a 'House' rather than a 'Home'"
"Explain the 'Transition' from Stanza 1 to Stanza 2.","It is a journey from the 'Skin' to the 'Heart'"
"Why is 'You're' used in 'Showing you're always caring'?","To make the message personal to the reader"
"How does the poem 'Validate' the reader's home life?","By making love the gold standard of a good home"
"What is the 'Final' definition of a Home?","A collective of loved ones doing unselfish acts"
"What is the 'Message' for future home-builders?","Focus on the family, not just the floor"