Question,Answer
"Analyze the 'Ship' metaphor in 'The Kite'.","It portrays the wind as a fluid ocean and the kite as a vessel navigating it"
"What is the significance of 'Anaphora' (repetition) in the poem?","The repeated 'What is...' or descriptions of motion create a rhythmic flight"
"How does the poet use 'Onomatopoeia' in the poem?","The word 'snaps' mimics the actual sound of the kite's tail in the wind"
"Analyze the 'Color Symbolism' of the 'Blue'.","The blue sky represents freedom, clarity, and the ideal state for dreams (the kite)"
"Explain the 'Nautical' imagery used throughout the poem.","Words like 'sail', 'tides', 'ride', and 'ship' link the air to the sea"
"What does the 'Raggeder thing' symbolize in a broader sense?","The loss of beauty and utility when one is trapped or restricted"
"How does the kite's 'dive and dip' represent the 'struggle' for height?","It shows that progress is not a straight line; it involves ups and downs"
"What is the 'Duality' of the wind in the poem?","It is both the life-giver (lift) and the destroyer (when it falls)"
"Analyze the 'Flyer's Role' as a 'Caregiver' of the kite.","The flyer must run, wind, and wait, showing that flight is a partnership"
"How does 'Bright' contrast with 'Raggeder'?","It creates a stark visual before-and-after of the kite's life cycle"
"What does 'Crest of a gust' imply about 'Timing' in life?","One must catch the peak of an opportunity to soar"
"Analyze the 'Simplicity' of a kite with 'only a sail'.","It suggests that great heights can be reached with very little, provided there is 'wind'"
"How does the 'Slack' string represent 'Loss of Inspiration'?","When the 'wind' (drive) stops, the connection to the 'goal' (kite) becomes loose"
"What is the 'Kinetic Energy' of the poem?","The use of active verbs like 'snaps', 'soars', 'rides', and 'climbs'"
"Explain the 'Finality' of the kite in the tree.","It is a 'pathetic' image (evoking pity) of something meant for the sky being earthbound"
"Analyze the 'Aesthetic' appeal of a new kite.","It is a symbol of fresh starts and the beauty of human creation"
"How does the 'New Breeze' serve as a 'Deus Ex Machina' (sudden help)?","It saves the kite from the 'slack' state and gives it a second life"
"What does 'Flaps on a string' tell us about 'Powerlessness'?","A trapped kite has energy (flapping) but no direction (stuck)"
"Analyze the 'Structure' of the poem.","It mirrors the flight—starting with a burst of energy and ending in a crash"
"What is the 'Sublime' (awe and terror) in 'The Kite'?","The awe of the high soar and the 'terror' of the ragged end"
"How does the poet 'Personify' the kite?","By giving it 'wings', a 'tail', and the ability to 'rest'"
"Analyze the 'Fluidity' of the air as described by Behn.","Air is treated as a 'tide' that can be ridden or fallen from"
"What does 'Wind it back' represent in terms of 'Resourcefulness'?","The flyer must manage their resources (string) during the 'lows'"
"Explain the 'Visual Contrast' of the red/bright kite against the blue sky.","It creates a high-visibility image of triumph"
"How does the 'Tree' act as the 'Antagonist' of the poem?","It is the obstacle that ends the kite's freedom and beauty"
"Analyze 'Snaps its tail' as a 'Soundscape'.","It breaks the silence of the sky with a sharp, rhythmic noise"
"What is the 'Aerodynamic' lesson in the poem?","That lift ('filling wings') is required to overcome gravity"
"How does the 'Flyer's running' show 'Human Effort' in dreams?","Dreams (kites) don't just fly; they require human 'running' and 'work'"
"What is the 'Tragedy' of the 'Raggeder' kite?","The loss of its 'brightness' and 'soaring' identity"
"Analyze the 'Verticality' of the poem.","It moves from the ground to the sky and back down to the 'top of a tree'"
"What does 'Crest' tell us about the 'Top' of achievement?","It is a place of great view but also high tension"
"How does the poem 'Celebrate' the ordinary?","By turning a simple toy into a grand ship of the sky"
"Explain the 'Tension' of the string.","It is the physical link between the 'Ideal' (sky) and the 'Real' (ground)"
"What is the 'Relief' in 'A new breeze blows'?","The restoration of purpose and movement"
"Analyze the 'Silence' of the wind falling.","It is the moment the 'music' of the flight stops"
"What does 'Never see' again imply about the raggeder kite?","It is a permanent loss of that specific beauty"
"How does the 'Sail' metaphor link to 'Ancient' travel?","It connects a modern toy to the age-old human desire to explore"
"Analyze the 'Texture' of the poem.","From the 'smooth' ride to the 'ragged' tear"
"What is the 'Perspective' of the narrator?","One of wonder, observation, and eventually, regret"
"How does the 'Tail' symbolize 'Balance' in life?","A little weight/stability is needed to fly high"
"Explain the 'Innocence' of the poem.","It is a simple joy that turns into a life lesson"
"Analyze the 'Motion' of 'Dipping and Diving'.","It is the 'dance' of the kite"
"What does 'Bright' signify about 'Potential'?","A new kite is full of 'flight' waiting to happen"
"How does the 'Tree' 'trap' the beauty?","By catching the string or the sail in its 'arms'"
"What is the 'Sound of Failure' in the poem?","The 'flapping' on a string in the tree"
"Analyze the 'Simile' of the ship as 'Power'.","A ship is a mighty thing, giving the small kite a sense of grandeur"
"What does 'Wing' represent for a paper object?","The transformation of paper into a 'living' flyer"
"How does 'Harry Behn' capture the 'Essence' of childhood?","Through the universal experience of flying and losing a kite"
"What is the 'Finality' of the 'Raggeder' state?","It cannot be undone; the kite's 'story' is over"
"What is the 'Ultimate' message?","Appreciate the 'bright' soar, for the 'ragged' end is inevitable"