Question,Answer
"Explain the simile 'soars like a ship'.","The kite moves gracefully through air just as a ship moves through water"
"What does 'snaps its tail' imply about the kite's energy?","It shows the kite is lively and moving with force"
"Why does the kite 'seem to rest' when the wind falls?","Because without air pressure, it stops soaring and floats down"
"What does 'climbing to the crest' tell us about the kite’s height?","It reaches the highest point of the wind's power"
"What is the significance of the word 'blue' being used for sky?","It suggests a clear, perfect day for flying"
"Describe the 'effort' of the person flying the kite.","They must run and wind the string to keep it in the air"
"How does a 'new breeze' act as a restart for the kite?","It provides the lift needed to go up after the string went slack"
"What makes a kite 'raggeder'?","Being torn and battered by the branches of a tree"
"Why is a kite in a tree no longer 'bright'?","Because it is damaged, stuck, and has lost its beauty of motion"
"What are the 'tides' mentioned in the poem?","The waves or currents of the wind"
"How does 'sails' relate to the kite's structure?","The paper or cloth acts like a sail to catch the wind"
"What does 'slack' suggest about the relationship between kite and flyer?","A temporary loss of tension and control"
"Why does the kite 'dive and dip'?","To find balance and gain momentum in the air"
"What does 'wings fill' mean scientifically?","The air pressure underneath the kite's surface creates lift"
"Why does the poet use 'only' in 'only a sail'?","To emphasize the simplicity and lightness of the kite"
"What is a 'gust' in the context of the poem?","A sudden burst of wind that carries the kite higher"
"Describe the 'raggeder' sight.","A kite flapping helplessly, unable to fly again"
"What does 'ride' imply about the kite’s movement?","It suggests a smooth, floating motion over the wind"
"How does the flyer 'wind it back'?","By turning the reel to take in the loose string"
"What does the kite's 'tail' help it do?","It provides stability and balance during flight"
"Why is 'Bright' the first word used to describe the kite?","To capture the reader's attention and set a positive tone"
"Explain the 'tides of wind' metaphor.","Wind is compared to an ocean that the kite 'sails' across"
"What does 'until a new breeze blows' suggest?","Patience is needed when the wind disappears"
"What is the difference between 'soaring' and 'flapping'?","Soaring is controlled and high; flapping is messy and stuck"
"How does the kite's color change in the reader's mind?","From bright and new to dull and ragged"
"What does 'snaps' suggest about the material?","It is likely thin and light, like paper"
"What does 'crest' represent in the wind's journey?","The peak of the wind's wave"
"Why is the kite compared to a ship instead of a bird?","To emphasize the 'sailing' and 'steering' aspect of the string"
"What does 'pulls' tell us about the wind's strength?","The wind is strong enough to tug hard on the flyer's hand"
"What is the 'blue' sky a 'canvas' for?","The kite's bright colors"
"Describe the 'rest' of a kite.","A moment of stillness before the next gust"
"What does 'raggeder' imply about the kite's future?","It is likely ruined and cannot be used again"
"Why does the poet focus on the 'tail'?","Because its movement provides the 'snap' and visual trail"
"What is the 'new breeze's' job?","To 'fill' the kite's wings and lift it"
"How does 'running' help the flyer?","It creates artificial wind to get the kite off the ground"
"What does 'climb' suggest about the kite's effort?","It moves upward against gravity"
"Why is the kite 'caught'?","It flew too close to an obstacle or lost its wind"
"What does 'flaps' mean in the tree?","The wind is blowing the kite, but it can't move away"
"Is the kite 'alive' in the poet's eyes?","Yes, he gives it many active, living verbs"
"What does 'bright' mean for a new kite?","Shiny, colorful, and attractive"
"What does 'wind it back' prevent?","It prevents the string from tangling on the ground"
"Explain the 'dip and dive' motion.","The erratic but graceful movement as it enters a current"
"What is the 'sail' of a ship compared to in a kite?","The broad surface area of the kite"
"Why is the sky called 'blue' instead of 'air'?","To create a vivid visual image"
"What does 'raggeder thing' feel like to the reader?","A sense of pity or waste"
"What 'fills' the wings?","The breeze/air"
"What is the 'crest of a gust'?","The strongest part of the wind"
"How does the poet describe the string?","As something that can go 'slack'"
"Why does the kite 'snap' its tail?","As a reaction to the sudden 'dive' and 'dip'"
"What is the 'end' of the kite's journey in the poem?","Being stuck and torn in a tree"