Question,Answer
"Why does the poet compare English to a 'game'?","To show that language is creative, fun, and has rules anyone can learn"
"Explain the metaphor 'Words are the food and dress of thought'.","Words provide the substance (food) and the presentation (dress) for our ideas"
"What does 'shrivel and die' suggest about unexpressed thoughts?","That thoughts lose their value and life if they are kept inside"
"Why are thoughts described as being in a 'prison'?","Because without words, they are trapped in the mind and cannot be shared"
"What is the significance of 'matching' words to 'brightest thoughts'?","It emphasizes the need for precision and clarity in communication"
"How can words give a thought 'body and swing'?","They give it a physical form (sound/writing) and a rhythmic energy"
"What does 'longing' to hear 'fresh and beautiful' things imply?","People are tired of clichés and are waiting for original, sincere ideas"
"Why does the poet say 'all of you can play it'?","To encourage everyone to use their voice and not be intimidated by language"
"What does 'groom' mean in the context of thoughts?","To refine, polish, and prepare an idea to be presented to the world"
"How does the poem celebrate the English language?","By calling it 'wonderful' and highlighting its ability to set minds free"
"What is the danger of not finding the right words?","The thought remains 'caged' and eventually disappears"
"Explain 'fresh and beautiful' as a goal for speakers.","It encourages creativity and moving away from boring or repetitive speech"
"How do words 'free' a prisoner?","By acting as the key that opens the mind to the outside world"
"What does 'brightest' tell us about our potential?","We all have brilliant ideas that deserve to be seen"
"Why is the mind located 'behind your eyes' in the poem?","It is a poetic way of describing the internal world of the brain"
"What is the 'body' of a thought?","The physical presence it gains once it is spoken or written"
"How does the poet use 'Auditory Imagery'?","Through words like 'swing', 'chanting' (implied), and 'hearing'"
"Define 'sincerity' as suggested by the poem.","Choosing words that truly match the brightness of the thought"
"What does 'play the game' imply about effort?","That using language requires participation and practice"
"Why are words 'wonderful'?","Because they have the power to turn a silent idea into a living reality"
"How does the poem address 'Intellectual Isolation'?","By showing that words are the bridge to other people"
"What is the 'dress' of thought meant to achieve?","To make an idea attractive and understandable to others"
"Why is 'food' a good metaphor for words?","Because thoughts need the energy of language to survive and grow"
"What is the 'loveliest thing' according to the poet?","A thought that has been freed and shared beautifully"
"How does the poem encourage 'Vocabulary Building'?","By suggesting we should 'match' and 'search' for the best words"
"What does 'shrivel' imply about the 'organic' nature of thoughts?","Thoughts are like living plants that need 'watering' with words"
"Why is 'swing' used to describe a thought?","It suggests a sense of freedom, dance, and musicality in speech"
"What is the 'prison' a metaphor for?","The inability to express oneself"
"How do words 'clothe' a thought?","By giving it a 'shape' that others can recognize"
"What is the 'message' for shy people?","Don't let your thoughts die; find the words to set them free"
"Why is English 'wonderful' in the poet's eyes?","It is a tool for liberation and beauty"
"Explain 'matching' as a craft.","It is the careful work of a writer or speaker to be accurate"
"What is the 'beautiful thing' the world is waiting for?","Your unique perspective or idea"
"How does 'grooming' relate to 'editing'?","It is the process of making an idea clear and neat"
"What does 'behind your eyes' suggest about 'vision'?","Internal vision needs external words to be seen by others"
"Why is the 'game' inclusive?","Because everyone has a mind and access to language"
"What is the 'soul' of the poem?","The belief that every thought is valuable enough to be spoken"
"How does 'shrivel' create a 'warning' tone?","It shows the negative consequence of staying silent"
"What is 'freshness' in language?","Originality and sincerity"
"How do words give 'life'?","By transforming a private impulse into a shared experience"
"What is the 'rhythm' of the game?","The 'swing' and flow of good communication"
"Why use 'brightest' for thoughts?","To remind us that our minds are full of light"
"What is the 'key' to the prison?","The English language (or any language)"
"How does the poem value the 'listener'?","By mentioning that they are 'longing' to hear something good"
"What is 'the dress of thought' in terms of 'rhetoric'?","The style and tone we use to speak"
"Why is 'food' necessary for thought?","To give it the 'weight' and 'substance' to last"
"How does the poet 'dignify' words?","By calling them 'wonderful' and 'wonderful words'"
"What is the 'climax' of the poem?","The moment a thought is freed from its prison"
"Why is 'English' the example?","It is a versatile and rich language for the 'game'"
"What is the 'final' advice?","Don't be a prisoner of your own mind; speak"