Question,Option A,Option B,Option C,Option D,Correct Answer
What educational philosophy is followed?,Traditional,Experiential learning,Exam-based,Online,Experiential learning
Why is discomfort pedagogically important?,Punishment,Empathy building,Control,Assessment,Empathy building
What does Blind Day symbolize?,Ignorance,Dependency,Human limitation,Failure,Human limitation
How is success redefined?,High marks,Character growth,Discipline,Competition,Character growth
What social issue is addressed?,Poverty,Disability awareness,Illiteracy,Gender bias,Disability awareness
Why is experiential learning superior?,Faster learning,Deeper understanding,Easy teaching,Less effort,Deeper understanding
What does Miss Beam reject?,Marks,Teachers,Bookish rigidity,Rules,Bookish rigidity
What kind of citizens are aimed?,Obedient,Competitive,Humane,Powerful,Humane
Why is empathy a life skill?,Marks,Social harmony,Authority,Personal gain,Social harmony
What ethical principle guides the school?,Utility,Compassion,Authority,Power,Compassion
Why is learning internalized?,Fear,Marks,Personal experience,Punishment,Personal experience
What does helper role symbolize?,Power,Leadership,Shared responsibility,Superiority,Shared responsibility
Why are values inseparable from education?,Demand,Long-term behavior,Easy teaching,Rules,Long-term behavior
What does the school critique?,Teachers,Students,Exam obsession,Parents,Exam obsession
What psychological method is used?,Fear conditioning,Empathy induction,Reward system,Punishment,Empathy induction
Why is rotation ethically fair?,Equal suffering,Shared learning,No bias,Control,Shared learning
What does disability simulation achieve?,Entertainment,Sympathy,Empathy,Pity,Empathy
Why is pity avoided?,It comforts,It disrespects,It weakens,It isolates,It disrespects
What does narrator’s admiration indicate?,Novelty,Entertainment,Educational success,Emotion,Educational success
What long-term change is targeted?,Marks,Behavioral change,Fame,Authority,Behavioral change
What is the core conflict?,Comfort vs learning,Marks vs values,Freedom vs discipline,Rules vs fun,Marks vs values
Why is character education emphasized?,Social survival,Moral development,Authority,Discipline,Moral development
What learning theory applies?,Behaviorism,Constructivism,Humanism,Traditionalism,Humanism
Why is moral learning experiential?,Quicker,Easier,Lasts longer,Cheaper,Lasts longer
What does Blind Day remove psychologically?,Vision,Control,Independence,Confidence,Independence
What ethical value is central?,Justice,Empathy,Obedience,Power,Empathy
Why does Miss Beam trust experience?,Tradition,Authority,Rules,Evidence-based,Evidence-based
What does the school symbolize?,Fantasy,Experiment,Ideal education,Discipline,Ideal education
Why is struggle temporary?,Punishment ends,Assessment ends,Learning goal,Teacher orders,Learning goal
What does the story advocate?,Avoid exams,Reform education,Strict discipline,No rules,Reform education
What authority does Miss Beam show?,Coercive,Legal,Political,Moral,Moral
What does experiential learning demand?,Time,Effort,Engagement,All of these,All of these
Why is empathy transformative?,Builds fear,Changes perspective,Increases marks,Reduces rules,Changes perspective
What social value is promoted?,Competition,Cooperation,Individualism,Power,Cooperation
What is the ultimate aim of education?,Employment,Exams,Humaneness,Discipline,Humaneness
Why are children not resentful?,Fear absent,Purpose clear,Rewards given,Marks assured,Purpose clear
What does the story finally affirm?,Marks matter,Rules matter,Values matter,Fear works,Values matter
