Question,Option A,Option B,Option C,Option D,Correct Answer
What is the central philosophy?,Aesthetic humanism,Nature worship,Material rejection,Romanticism,Aesthetic humanism
Why is beauty omnipresent?,Nature’s continuity,Human perception,Universal order,Both A and B,Both A and B
What poetic device dominates?,Simile,Imagery,Alliteration,Metaphor,Imagery
Why is beauty linked to peace?,Sensory harmony,Mental calm,Emotional balance,All,All
What worldview does poem present?,Materialistic,Humanistic,Nature-centric,Pessimistic,Nature-centric
Why does poet avoid conflict?,Focus on contemplation,Maintain calm,Theme demands,Both A and B,Both A and B
What does repetition of day/night imply?,Timelessness,Continuity,Cycle of beauty,All,All
Why are ordinary scenes used?,Accessibility,Universality,Relatability,All,All
What does poem reject implicitly?,Material excess,Artificial beauty,Neglect of nature,Both A and C,Both A and C
What role does perception play?,Creates beauty,Recognizes beauty,Limits beauty,None,Recognizes beauty
Why is beauty democratic?,Available to all,No ownership,No cost,Both A and C,Both A and C
What ethical value is promoted?,Contentment,Peace,Awareness,All,All
What is poet’s stance?,Observational,Didactic,Neutral,Gentle instructive,Gentle instructive
Why is beauty everlasting?,Nature renews,Human appreciation,Daily presence,Both A and C,Both A and C
What emotional response is desired?,Awe,Peace,Joy,Both A and B,Both A and B
Why is poem minimalistic?,Clarity,Simplicity,Focus,Both A and B,Both A and B
What does beauty oppose?,Chaos,Stress,Material obsession,All,All
What kind of knowledge is implied?,Sensory awareness,Intellectual,Scientific,Abstract,Sensory awareness
Why does poet include sounds?,Multi-sensory appeal,Depth of imagery,Realism,Both A and B,Both A and B
What philosophical message emerges?,Slow living,Appreciation of present,Mindfulness,Both B and C,Both B and C
What is beauty’s function?,Decorative,Transformative,Entertaining,None,Transformative
Why is poem timeless?,Universal theme,Natural imagery,Human experience,All,All
What does poet celebrate?,Ordinary moments,Grand scenes,Luxury,None,Ordinary moments
Why is beauty subtle?,Requires attention,Not flashy,Quiet presence,All,All
What does poem resist?,Speed culture,Noise pollution,Materialism,All,All
What role does nature play?,Teacher,Healer,Inspiration,All,All
What does poem imply about happiness?,Found outside,Found within awareness,Purchased,Inherited,Found within awareness
Why is poem not prescriptive?,No commands,Observational tone,Implicit lesson,Both B and C,Both B and C
What is the poem’s emotional register?,Calm,Joyful,Reflective,All,All
What does poet trust?,Nature’s order,Human perception,Daily beauty,Both A and B,Both A and B
What is the poem’s ethical stance?,Aesthetic ethics,Moral absolutism,Utilitarianism,None,Aesthetic ethics
Why is beauty linked to time?,Day-night cycle,Continuity,Presence,Both A and B,Both A and B
What does poem subtly teach?,Mindfulness,Gratitude,Simplicity,All,All
What makes beauty resilient?,Change of form,Daily renewal,Nature’s cycle,All,All
What does poet avoid judging?,Human actions,Modern life,Material choices,Both A and B,Both A and B
What is the poem’s core insight?,Beauty sustains peace,Nature heals mind,Awareness reveals beauty,All,All
What kind of fulfillment is implied?,Sensory peace,Inner calm,Emotional balance,All,All
What does beauty counter?,Stress,Chaos,Neglect,All,All
What does poem affirm?,Life is beautiful,Nature comforts,Beauty accessible,Both B and C,Both B and C
What lens is used?,Aesthetic,Philosophical,Observational,All,All
What remains constant?,Beauty,Change,Time,None,Beauty
What is the lasting takeaway?,See beauty daily,Slow down,Be mindful,All,All
