Question,Answer
Analyse Patrick’s character development throughout the story.,Patrick evolves from a lazy, irresponsible boy into a disciplined, hardworking student through consistent effort.
Critically examine the role of the elf in Patrick’s transformation.,The elf acts as a motivator rather than a helper, forcing Patrick to take responsibility.
How does the story redefine the concept of magic?,Magic is redefined as hard work and self-effort rather than supernatural power.
Discuss the irony in Patrick’s wish.,Patrick wished to avoid homework but ended up doing more than ever.
Explain how responsibility leads to self-growth.,Responsibility pushes individuals to develop discipline and skills.
How does the story challenge the idea of shortcuts to success?,It shows shortcuts fail without real effort.
Analyse the educational message of the chapter.,The chapter promotes self-learning, discipline, and perseverance.
Why is Patrick’s success sustainable?,Because it is built on knowledge and habits.
Explain the psychological change in Patrick.,Patrick shifts from avoidance to acceptance of responsibility.
How does the story use fantasy to teach realism?,Fantasy attracts attention while realism delivers the lesson.
Why is the elf dependent on Patrick?,Because true learning requires human effort.
Discuss the theme of self-reliance.,Patrick learns to rely on himself rather than magic.
How does effort replace luck in the story?,Patrick’s effort determines success, not luck.
Explain why Patrick’s improvement surprised others.,Because it contradicted his past behavior.
Analyse the moral significance of the ending.,It reinforces the importance of effort.
How does the story reflect real student life?,Many students seek shortcuts instead of studying.
Explain how discipline changes outcomes.,Discipline leads to steady improvement.
Why is the title a question?,It invites readers to think about who truly worked.
Analyse the symbolic meaning of homework.,Homework symbolises responsibility.
How does the story discourage dependency?,Patrick becomes independent through learning.
Explain the transformation in Patrick’s mindset.,He begins to value learning.
Why is effort shown as empowering?,It gives confidence and control.
How does the elf represent external motivation?,The elf forces Patrick to act.
Discuss the role of repetition and practice.,They strengthen understanding.
Why is Patrick’s growth gradual?,True learning takes time.
How does the story define success?,Success is improvement, not perfection.
Explain the relationship between effort and reward.,Effort leads to reward.
How does Patrick’s struggle contribute to growth?,Struggle builds resilience.
Why is the story relevant for students today?,Students still seek shortcuts.
Analyse the contrast between magic and education.,Magic fails, education succeeds.
How does the story promote accountability?,Patrick accepts responsibility.
Explain how learning becomes enjoyable.,Practice builds confidence.
Why is the elf unnecessary by the end?,Patrick becomes self-sufficient.
How does the story portray true intelligence?,Intelligence grows through effort.
Analyse Patrick’s sense of achievement.,It comes from earned success.
Why is the elf a temporary character?,External motivation is temporary.
Explain the importance of persistence.,Persistence ensures mastery.
How does the story inspire behavioral change?,It shows rewards of effort.
Why does Patrick stop complaining?,He accepts responsibility.
Discuss the theme of transformation.,Personal growth through effort.
How does the story reject excuses?,Success requires action.
Explain how education shapes character.,It builds discipline and values.
Why is hard work portrayed as liberating?,It gives independence.
Analyse the role of failure.,Struggle leads to improvement.
How does the story teach life skills?,Time management and discipline.
Why is Patrick a role model?,He learns through effort.
Explain how habits define success.,Good habits lead to achievement.
Discuss the relevance of the story’s message.,Hard work remains timeless.
How does the story encourage self-discipline?,By showing its rewards.
Explain the deeper meaning of the elf’s disappearance.,Patrick no longer needs external push.
Why is personal effort the true magic?,Because it creates lasting success.
